name,terminology,code,term
Operation performed,IPCCC,120277,Ebstein malformation of tricuspid valve repair: tricuspid valve closure & shunt (Starnes)
Operation performed,IPCCC,120283,Tricuspid valve repair converted to tricuspid valvar replacement
Operation performed,IPCCC,120286,"Ebstein malformation or dysplasia of tricuspid valve repair: cone procedure,"
Operation performed,IPCCC,120299,"Transluminal tricuspid valve in prosthetic valve replacement,"
Operation performed,IPCCC,120300,Mitral valvar procedure
Operation performed,IPCCC,120301,Mitral valvotomy
Operation performed,IPCCC,120303,Mitral leaflet (valvoplasty) procedure
Operation performed,IPCCC,120304,Mitral valvar annuloplasty
Operation performed,IPCCC,120310,Balloon dilation of mitral valve
Operation performed,IPCCC,120311,Mitral valvar replacement
Operation performed,IPCCC,120319,Mitral subvalvar apparatus procedure
Operation performed,IPCCC,120384,Mitral valve repair converted to mitral valvar replacement
Operation performed,IPCCC,120397,Transluminal mitral valve repair
Operation performed,IPCCC,120400,Atrioventricular septal defect procedure
Operation performed,IPCCC,120401,Atrioventricular septal defect (AVSD): partial (primum ASD) repair
Operation performed,IPCCC,120409,Atrioventricular septal defect (AVSD): partial with isolated ventricular component (VSD) repair
Operation performed,IPCCC,120418,Common atrioventricular valve replacement
Operation performed,IPCCC,120420,Atrioventricular septal defect (AVSD): right atrioventricular valvar procedure
Operation performed,IPCCC,120433,Common atrioventricular valve repair converted to atrioventricular valvar replacement
Operation performed,IPCCC,120440,Atrioventricular septal defect (AVSD): left atrioventricular valvar procedure
Operation performed,IPCCC,120445,Atrioventricular septal defect (AVSD): left atrioventricular valvar replacement
Operation performed,IPCCC,120489,Mitral valve replacement with stented bovine jugular vein conduit
Operation performed,IPCCC,120490,Transluminal mitral valve in prosthetic valve replacement
Operation performed,IPCCC,120501,Atrioventricular septal defect (AVSD): complete (common valve orifice) repair
Operation performed,IPCCC,120510,Atrioventricular septal defect (AVSD): 'intermediate' repair
Operation performed,IPCCC,120511,Atrioventricular septal defect (AVSD) & Tetralogy of Fallot repair
Operation performed,IPCCC,120600,Right ventricular outflow tract procedure
Operation performed,IPCCC,120605,Balloon dilation of right ventricular outflow tract
Operation performed,IPCCC,12061,Right ventricle to pulmonary artery valveless conduit construction
Operation performed,IPCCC,120618,Stent placement in right ventricular outflow tract
Operation performed,IPCCC,120619,1.5 ventricle repair: superior cavopulmonary (Glenn) anastomosis + right ventricular outflow tract reconstruction
Operation performed,IPCCC,120625,Transluminal right ventricular biopsy
Operation performed,IPCCC,120626,Right ventricular procedure
Operation performed,IPCCC,120635,Double chambered right ventricle repair
Operation performed,IPCCC,120638,Right ventricular aneurysm repair
Operation performed,IPCCC,120641,Right ventricular outflow tract obstruction relief
Operation performed,IPCCC,120643,Right ventricle to pulmonary artery valveless conduit construction (Japanese modification: 'Sano') as part of Norwood procedure
Operation performed,IPCCC,120700,Left ventricular outflow tract procedure
Operation performed,IPCCC,120701,Subaortic fibromuscular shelf resection
Operation performed,IPCCC,120707,Balloon dilation of left ventricular outflow tract
Operation performed,IPCCC,120711,Left ventricular outflow tract myectomy-myotomy
Operation performed,IPCCC,120712,Left ventricular outflow tract obstruction relief: complex (Konno etc)
Operation performed,IPCCC,120713,Left ventricular outflow tract obstruction relief
Operation performed,IPCCC,120719,Left ventricular outflow tract obstruction relief by transcatheter coronary chemical ablation
Operation performed,IPCCC,120726,Left ventricular procedure
Operation performed,IPCCC,120737,Left ventricular aneurysm repair
Operation performed,IPCCC,120738,Partial left ventriculectomy-volume reduction (Batista)
Operation performed,IPCCC,120801,Ventricular septal defect (VSD) closure
Operation performed,IPCCC,120802,Ventricular septal defect (VSD) closure by direct suture
Operation performed,IPCCC,120803,Ventricular septal defect (VSD) closure using patch
Operation performed,IPCCC,120806,Ventricular septal defect (VSD) enlargement
Operation performed,IPCCC,120807,Ventricular septal defect (VSD) closure with transluminal device
Operation performed,IPCCC,120816,Closure of multiple ventricular septal defect (VSD)s
Operation performed,IPCCC,120819,Open fenestration of ventricular septal defect (VSD) patch
Operation performed,IPCCC,120820,Transluminal fenestration of ventricular septal defect (VSD) patch
Operation performed,IPCCC,120821,Subpulmonary obstruction relief
Operation performed,IPCCC,120822,Subaortic obstruction relief
Operation performed,IPCCC,120828,Intraoperative ventricular septal defect (VSD) closure with transluminal device (hybrid approach)
Operation performed,IPCCC,120835,Ventricular septal defect (VSD) enlargement/ creation
Operation performed,IPCCC,120865,Transluminal interventricular communication creation
Operation performed,IPCCC,120901,Ventricular septation procedure
Operation performed,IPCCC,120903,Damus-Kaye-Stansel type procedure: pulmonary trunk to aorta end/side anastomosis
Operation performed,IPCCC,121000,Norwood type procedure
Operation performed,IPCCC,121004,"Hybrid approach 'Stage 1': application of bilateral pulmonary arterial bands & transcatheter placement of stent in arterial duct,"
Operation performed,IPCCC,121005,Hypoplastic left heart biventricular repair
Operation performed,IPCCC,121014,Stent placement in arterial duct (PDA)
Operation performed,IPCCC,121100,Common arterial trunk (truncus) repair
Operation performed,IPCCC,121134,Truncal valve cusp(s) repair (valvoplasty)
Operation performed,IPCCC,121141,Truncal valve replacement
Operation performed,IPCCC,121143,Truncal valve repair converted to truncal valvar replacement
Operation performed,IPCCC,121201,Aortopulmonary window closure
Operation performed,IPCCC,121208,Aortopulmonary window closure with transcatheter device
Operation performed,IPCCC,121300,Pulmonary valvar procedure
Operation performed,IPCCC,121302,Pulmonary valvotomy: open
Operation performed,IPCCC,121305,Balloon dilation of pulmonary valve
Operation performed,IPCCC,121309,Pulmonary valvar transluminal perforation & dilation
Operation performed,IPCCC,121312,Pulmonary valvectomy
Operation performed,IPCCC,121315,Pulmonary valve closure-oversewing
Operation performed,IPCCC,121321,Pulmonary valvar replacement (not conduit)
Operation performed,IPCCC,121322,Pulmonary valvar replacement using homograft
Operation performed,IPCCC,121351,Transluminal pulmonary valvar insertion with stent mounted valve
Operation performed,IPCCC,121355,Pulmonary valve repair converted to pulmonary valvar replacement
Operation performed,IPCCC,121381,"Transluminal aortic valvar insertion (TAVI) with stent mounted valve,"
Operation performed,IPCCC,121382,Transluminal aortic valvar insertion with stent mounted valve: reimplant (valve in valve)
Operation performed,IPCCC,121384,Transapical aortic valve implantation (hybrid approach)
Operation performed,IPCCC,121385,Transluminal pulmonary valvar insertion with stent mounted valve including prestenting
Operation performed,IPCCC,121386,Transluminal pulmonary valvar prestenting procedure in preparation for valve replacement
Operation performed,IPCCC,121387,Transluminal pulmonary valvar insertion with stent mounted valve with intentional rupture of previous conduit
Operation performed,IPCCC,121401,Pulmonary trunk arterioplasty
Operation performed,IPCCC,121402,Pulmonary trunk band (PA band)
Operation performed,IPCCC,121403,Pulmonary trunk band removal (de-band)
Operation performed,IPCCC,121405,Balloon dilation of pulmonary trunk
Operation performed,IPCCC,121408,Open adjustment of pulmonary trunk band
Operation performed,IPCCC,121419,Application of right & left pulmonary arterial bands
Operation performed,IPCCC,121420,Pulmonary arterioplasty/ reconstruction
Operation performed,IPCCC,121421,Pulmonary arterioplasty/ reconstruction: central (proximal to hilar bifurcation)
Operation performed,IPCCC,121422,Pulmonary arterioplasty/ reconstruction: peripheral (at-beyond hilar bifurcation)
Operation performed,IPCCC,121430,Pulmonary artery origin from ascending aorta (hemitruncus) repair
Operation performed,IPCCC,121431,Pulmonary artery ligation
Operation performed,IPCCC,121503,Balloon dilation of right pulmonary artery
Operation performed,IPCCC,121504,Balloon dilation of left pulmonary artery
Operation performed,IPCCC,121505,Application of right pulmonary artery band
Operation performed,IPCCC,121506,Application of left pulmonary artery band
Operation performed,IPCCC,121511,Procedure involving pulmonary artery
Operation performed,IPCCC,121513,Stent placement in right pulmonary artery
Operation performed,IPCCC,121514,Stent placement in left pulmonary artery
Operation performed,IPCCC,121524,Pulmonary artery aneurysm repair
Operation performed,IPCCC,121525,Pulmonary trunk flow restriction using transcatheter implanted device
Operation performed,IPCCC,121548,Pulmonary thromboembolectomy
Operation performed,IPCCC,121549,Transluminal embolectomy from pulmonary tree
Operation performed,IPCCC,121550,Stent placement in pulmonary tree
Operation performed,IPCCC,121553,Balloon dilation of pulmonary tree with cutting balloon
Operation performed,IPCCC,121570,Stent placement between left pulmonary artery and descending aorta (reverse Potts)
Operation performed,IPCCC,121580,Pulmonary thromboembolectomy for acute embolus
Operation performed,IPCCC,121581,Pulmonary thromboembolectomy for chronic (longstanding) embolus
Operation performed,IPCCC,121600,Aortic valvar procedure
Operation performed,IPCCC,121602,Aortic valvotomy: open
Operation performed,IPCCC,121604,Aortic valvotomy: closed
Operation performed,IPCCC,121605,Balloon dilation of aortic valve
Operation performed,IPCCC,121611,Aortic cusp(s) repair (valvoplasty)
Operation performed,IPCCC,121614,'Annuloplasty' of aortic valve
Operation performed,IPCCC,121621,Aortic valvar replacement
Operation performed,IPCCC,121622,Aortic valvar replacement using homograft
Operation performed,IPCCC,121625,Aortic valvar transluminal perforation & dilation
Operation performed,IPCCC,121628,Aortic valvar replacement using heterograft bioprosthesis
Operation performed,IPCCC,121629,Aortic valvar replacement using mechanical prosthesis
Operation performed,IPCCC,121630,Ross procedure: aortic valve or root replacement with pulmonary autograft & pulmonary valvar replacement
Operation performed,IPCCC,121633,Aortic root replacement + coronary artery reimplantation (Bentall)
Operation performed,IPCCC,121635,Ascending aorta replacement & aortic valvar resuspension
Operation performed,IPCCC,121640,Supravalvar aortic stenosis repair
Operation performed,IPCCC,121642,Aorta aneurysm repair
Operation performed,IPCCC,121650,Aortic root replacement (not Ross)
Operation performed,IPCCC,121659,Aortic dissection repair
Operation performed,IPCCC,121661,Aortic valve closure-oversewing
Operation performed,IPCCC,121662,Ross-Konno procedure
Operation performed,IPCCC,121663,Aortic root replacement using homograft
Operation performed,IPCCC,121664,Aortic root replacement using mechanical prosthesis
Operation performed,IPCCC,121665,Ascending aorta replacement
Operation performed,IPCCC,121666,Aortic arch aneurysm repair
Operation performed,IPCCC,121667,Descending aorta aneurysm repair
Operation performed,IPCCC,121668,Abdominal aorta aneurysm repair
Operation performed,IPCCC,121680,Aortic sinus of Valsalva procedure
Operation performed,IPCCC,121681,Aortic sinus of Valsalva distal fistula closure
Operation performed,IPCCC,121685,Aortic sinus of Valsalva aneurysm repair
Operation performed,IPCCC,121690,Aorto-left ventricular tunnel closure
Operation performed,IPCCC,121697,Aortic valve repair converted to aortic valvar replacement
Operation performed,IPCCC,121711,Vascular ring procedure
Operation performed,IPCCC,121731,Aortopexy
Operation performed,IPCCC,121732,Pulmonary arterial sling repair
Operation performed,IPCCC,121777,"Aortic valvar replacement using autologous pericardium constructed valve leaflets (Ozaki),"
Operation performed,IPCCC,121778,"Personalised external aortic root support (PEARS) procedure,"
Operation performed,IPCCC,121790,Aortic root replacement using bioprosthesis
Operation performed,IPCCC,121791,Aortic root replacement: valve sparing technique
Operation performed,IPCCC,121799,Aortic root replacement of implanted pulmonary autograft & pulmonary valve re-replacement
Operation performed,IPCCC,121800,Coarctation-hypoplasia of aorta repair
Operation performed,IPCCC,121801,Aortic coarctation-hypoplasia repair by resection & end to end anastomosis
Operation performed,IPCCC,121802,Aortic coarctation-hypoplasia repair by patch aortoplasty
Operation performed,IPCCC,121803,Aortic coarctation-hypoplasia repair by subclavian flap aortoplasty
Operation performed,IPCCC,121804,Balloon dilation of native aortic coarctation-hypoplasia
Operation performed,IPCCC,121808,Balloon dilation of aortic recoarctation
Operation performed,IPCCC,121810,Aortic coarctation-hypoplasia repair by resection & extended end to end anastomosis
Operation performed,IPCCC,121815,Aortic coarctation-hypoplasia repair by resection & insertion of tube graft
Operation performed,IPCCC,121817,Stent placement at site of aortic coarctation
Operation performed,IPCCC,121822,Stent placement at site of aortic recoarctation
Operation performed,IPCCC,121827,Aortic coarctation transluminal obstruction relief
Operation performed,IPCCC,121830,Aortic arch repair
Operation performed,IPCCC,121848,Stent placement at site of native aortic coarctation-hypoplasia
Operation performed,IPCCC,121870,Thoracic aorta aneurysm transcatheter stent implantation
Operation performed,IPCCC,122020,Hypoplastic left heart syndrome hybrid approach (transcatheter & surgery): stage 1
Operation performed,IPCCC,122021,Hypoplastic left heart syndrome hybrid strategy (transcatheter & surgery)
Operation performed,IPCCC,122022,Hypoplastic left heart syndrome hybrid approach (transcatheter & surgery) 'stage 2': aortopulmonary amalgamation + superior cavopulmonary anastomosis(es) + debanding of pulmonary arteries
Operation performed,IPCCC,122023,Hypoplastic left heart syndrome hybrid approach (transcatheter & surgery) 'stage 2': aortopulmonary amalgamation + superior cavopulmonary anastomosis(es) + debanding of pulmonary arteries + arch repair
Operation performed,IPCCC,122100,Interrupted aortic arch repair
Operation performed,IPCCC,122200,Systemic arterial procedure
Operation performed,IPCCC,122300,Anomalous coronary artery (eg ALCAPA) repair
Operation performed,IPCCC,122307,Coronary fistula procedure
Operation performed,IPCCC,122308,Coronary arterial bypass graft (CABG) procedure
Operation performed,IPCCC,122309,Coronary arterial procedure
Operation performed,IPCCC,122311,Ligation of coronary fistula
Operation performed,IPCCC,122313,Coronary arterial fistula transluminal occlusion
Operation performed,IPCCC,122330,Transluminal intracoronary injection of thrombolytic agent
Operation performed,IPCCC,122331,Transluminal balloon coronary angioplasty (PTCA)
Operation performed,IPCCC,122338,Transluminal coronary stent implantation
Operation performed,IPCCC,122341,Transluminal intracoronary echocardiography (IVUS)
Operation performed,IPCCC,122342,Transluminal chemical occlusion of coronary artery
Operation performed,IPCCC,122380,Anomalous aortic origin of coronary artery repair
Operation performed,IPCCC,122400,Arterial duct-ligament procedure
Operation performed,IPCCC,122404,Arterial duct (PDA) closure with transluminal device
Operation performed,IPCCC,122410,Arterial duct (PDA) closure
Operation performed,IPCCC,122420,Patent arterial duct (PDA) closure: surgical
Operation performed,IPCCC,122421,Arterial duct (PDA) closure with transluminal coil
Operation performed,IPCCC,122422,Arterial duct (PDA) closure with transluminal Amplatzer plug
Operation performed,IPCCC,122500,Systemic-to-pulmonary collateral artery(ies) (MAPCA(s)) unifocalisation procedure
Operation performed,IPCCC,122502,Arteriovenous fistula occlusion
Operation performed,IPCCC,122507,Pulmonary arteriovenous fistula closure
Operation performed,IPCCC,122518,Systemic-to-pulmonary collateral artery(ies) (MAPCA(s)) occlusion
Operation performed,IPCCC,122519,Transluminal procedure to systemic-to-pulmonary collateral artery (MAPCA(s))
Operation performed,IPCCC,122562,Stent placement in systemic-to-pulmonary collateral artery (MAPCA(s))
Operation performed,IPCCC,122565,Transluminal occlusion of systemic-to-pulmonary collateral artery(ies) (MAPCA(s)) with coil-device
Operation performed,IPCCC,122567,Unilateral Systemic-to-pulmonary collateral artery(ies) (MAPCA(s)) unifocalisation procedure
Operation performed,IPCCC,122572,Balloon dilation of systemic-to-pulmonary collateral artery(ies) (MAPCA(s))
Operation performed,IPCCC,122587,Bilateral systemic-to-pulmonary collateral artery(ies) (MAPCA(s)) unifocalisation procedure: complete with all usable collaterals incorporated
Operation performed,IPCCC,122588,Bilateral systemic-to-pulmonary collateral artery(ies) (MAPCA(s)) unifocalisation procedure: incomplete with not all usable collaterals incorporated
Operation performed,IPCCC,122601,Tetralogy of Fallot repair
Operation performed,IPCCC,122613,Tetralogy of Fallot repair with transannular patch
Operation performed,IPCCC,122620,Tetralogy of Fallot repair without transannular patch
Operation performed,IPCCC,122621,Absent pulmonary valve syndrome (Fallot type) repair
Operation performed,IPCCC,122701,Double outlet right ventricle with subaortic or doubly committed ventricular septal defect (VSD) & pulmonary stenosis (Fallot-type) repair
Operation performed,IPCCC,122702,Double outlet right ventricle repair with intraventricular tunnel
Operation performed,IPCCC,122745,REV procedure: intraventricular left ventricle to aorta tunnel with infundibular septum resection & direct right ventricle to pulmonary trunk anastomosis
Operation performed,IPCCC,122746,Congenitally corrected transposition of great arteries repair
Operation performed,IPCCC,122750,Double outlet left ventricle repair
Operation performed,IPCCC,122778,Aortic root translocation to over left ventricle (including Nikaidoh)
Operation performed,IPCCC,122801,Pulmonary atresia & ventricular septal defect (VSD) (including Fallot-type) repair
Operation performed,IPCCC,122811,"Pulmonary atresia, ventricular septal defect (VSD) & systemic-to-pulmonary collateral artery(ies) (MAPCA(s)) repair"
Operation performed,IPCCC,122821,"Pulmonary atresia, ventricular septal defect (VSD) & systemic-to-pulmonary collateral artery(ies) (MAPCA(s)) repair: status post complete unifocalisation with all usable collaterals incorporated"
Operation performed,IPCCC,122822,"Pulmonary atresia, ventricular septal defect (VSD) & systemic-to-pulmonary collateral artery(ies) (MAPCA(s)) repair: status post incomplete unifocalisation with not all usable collaterals incorporated"
Operation performed,IPCCC,122901,Senning procedure (atrial inversion)
Operation performed,IPCCC,122902,Mustard procedure (atrial inversion)
Operation performed,IPCCC,122911,Rastelli procedure: intraventricular left ventricle to aorta tunnel & right ventricle to pulmonary artery conduit
Operation performed,IPCCC,122920,Double outlet right ventricle repair
Operation performed,IPCCC,122921,Arterial switch procedure
Operation performed,IPCCC,122925,Arterial switch & atrial inversion procedures ('double switch')
Operation performed,IPCCC,122926,Atrial inversion and Rastelli procedures
Operation performed,IPCCC,122940,Complex transposition of great arteries repair
Operation performed,IPCCC,122952,Pulmonary venous pathway procedure (post Senning-Mustard)
Operation performed,IPCCC,122979,Atrial inversion procedure (Mustard or Senning) revision
Operation performed,IPCCC,123001,Fontan type procedure
Operation performed,IPCCC,123005,Total cavopulmonary connection (TCPC) using extracardiac inferior caval vein (IVC)-pulmonary artery conduit with fenestration
Operation performed,IPCCC,123006,Total cavopulmonary connection (TCPC) with fenestrated lateral atrial tunnel
Operation performed,IPCCC,123013,Fontan procedure with atrioventricular connection
Operation performed,IPCCC,123020,Fenestration of atrial septum
Operation performed,IPCCC,123021,Right atrial septum-tunnel fenestration closure with transluminal device
Operation performed,IPCCC,123027,Fenestration of Fontan type connection
Operation performed,IPCCC,123028,Fontan-type connection without fenestration
Operation performed,IPCCC,123031,Takedown of Fontan type procedure
Operation performed,IPCCC,123032,Fontan procedure with direct atriopulmonary anastomosis
Operation performed,IPCCC,123034,Conversion of Fontan repair to total cavopulmonary connection
Operation performed,IPCCC,123037,Fontan type procedure revision or conversion
Operation performed,IPCCC,123041,Atrial fenestration closure
Operation performed,IPCCC,123050,Total cavopulmonary connection (TCPC)
Operation performed,IPCCC,123051,Total cavopulmonary conn (TCPC) with lateral atrial tunnel
Operation performed,IPCCC,123054,Total cavopulmonary connection (TCPC) using extracardiac inferior caval vein (IVC)-pulmonary artery conduit
Operation performed,IPCCC,123056,Takedown of total cavopulmonary connection (TCPC)
Operation performed,IPCCC,123060,Completion of total cavopulmonary connection (TCPC) using transcatheter inferior to superior caval vein covered stent
Operation performed,IPCCC,123074,Transluminal interatrial communication creation
Operation performed,IPCCC,123092,"Total cavopulmonary connection (TCPC) using intra-extracardiac conduit: fenestrated,"
Operation performed,IPCCC,123093,"Total cavopulmonary connection (TCPC) using intra-extracardiac conduit: nonfenestrated,"
Operation performed,IPCCC,123103,Modified right Blalock interposition shunt
Operation performed,IPCCC,123104,Modified left Blalock interposition shunt
Operation performed,IPCCC,123105,Waterston (ascending aorta-right pulmonary artery) anastomosis
Operation performed,IPCCC,123106,Central systemic-to-pulmonary arterial interposition shunt
Operation performed,IPCCC,123111,Bidirectional superior cavopulmonary (Glenn) anastomosis
Operation performed,IPCCC,123115,Hemi-Fontan procedure
Operation performed,IPCCC,123119,Balloon dilation of systemic-to-pulmonary arterial shunt
Operation performed,IPCCC,123130,Systemic-to-pulmonary arterial shunt procedure
Operation performed,IPCCC,123131,Closure of systemic-to-pulmonary arterial shunt
Operation performed,IPCCC,123134,Occlusion of systemic-to-pulmonary arterial shunt by transluminal device-embolus
Operation performed,IPCCC,123142,Takedown of Glenn
Operation performed,IPCCC,123144,Bilateral bidirectional superior cavopulmonary (Glenn) anastomoses
Operation performed,IPCCC,123145,Unidirectional superior cavopulmonary (Glenn) anastomosis
Operation performed,IPCCC,123146,Modified Blalock interposition shunt
Operation performed,IPCCC,123172,Superior caval vein to pulmonary artery anastomosis
Operation performed,IPCCC,123200,Postoperative procedure
Operation performed,IPCCC,123203,Exploratory procedure to assess heart
Operation performed,IPCCC,123206,Lung biopsy procedure
Operation performed,IPCCC,123209,Pericardiectomy
Operation performed,IPCCC,123210,Heart tumour resection
Operation performed,IPCCC,123213,Transplantation of heart and lungs
Operation performed,IPCCC,123214,DC cardioversion
Operation performed,IPCCC,123217,Parietal pleurectomy
Operation performed,IPCCC,123218,Postoperative procedure to control bleeding
Operation performed,IPCCC,123220,Removal of cardiac vegetations
Operation performed,IPCCC,123221,Cardiac procedure
Operation performed,IPCCC,123222,Removal of cardiac thrombus
Operation performed,IPCCC,123228,Thoracic duct occlusion
Operation performed,IPCCC,123229,Diaphragm procedure
Operation performed,IPCCC,123240,Pericardiocentesis
Operation performed,IPCCC,123241,Pericardial drainage: open (pericardiotomy)
Operation performed,IPCCC,123243,Pericardiocentesis: percutaneous transcatheter
Operation performed,IPCCC,123246,Pericardial window creation
Operation performed,IPCCC,123253,Pericardial biopsy
Operation performed,IPCCC,123259,Procedure involving pericardium
Operation performed,IPCCC,123270,Plication of hemidiaphragm
Operation performed,IPCCC,123280,Insertion of pleural tube drain
Operation performed,IPCCC,123283,Insertion of mediastinal tube drain
Operation performed,IPCCC,123290,Instigation of renal dialysis
Operation performed,IPCCC,123310,Traumatic injury of heart repair
Operation performed,IPCCC,123351,Peripheral vascular procedure
Operation performed,IPCCC,123352,Non-cardiothoracic-vascular procedure
Operation performed,IPCCC,123353,Non-cardiothoracic-vascular procedure on cardiac patient under cardiac anaesthesia
Operation performed,IPCCC,123360,Operation related to transcatheter procedure
Operation performed,IPCCC,123450,Pacemaker system placement: single chamber
Operation performed,IPCCC,123451,Pacemaker system placement: dual chamber
Operation performed,IPCCC,123452,Pacemaker system placement: biventricular
Operation performed,IPCCC,123460,Pacemaker system placement: temporary
